{
  "$schema": "https://json-schema.org/draft/2020-12/schema",
  "title": "ContactChange",
  "description": "Represents a change in a contact within Producerflow",
  "type": "object",
  "properties": {
    "id": {
      "type": "string",
      "description": "Unique identifier for the change"
    },
    "event_type": {
      "type": "string",
      "description": "Type of event that occurred (e.g., 'contact.updated', 'contact.created')"
    },
    "change_type": {
      "type": "string",
      "description": "Type of change that occurred (deprecated, use event_type instead)",
      "enum": ["Created", "Updated", "Deleted"]
    },
    "origin": {
      "type": "string",
      "description": "Source of the change",
      "enum": ["ProducerFlowAPI", "ProducerFlowPortal", "NIPR"]
    },
    "timestamp": {
      "type": "string",
      "description": "Time when the change occurred",
      "format": "date-time"
    },
    "agency_id": {
      "type": "string",
      "description": "ID of the agency that the contact belongs to"
    },
    "city": {
      "type": "string",
      "description": "City of the contact"
    },
    "contact_id": {
      "type": "string",
      "description": "Unique identifier for the contact"
    },
    "email": {
      "type": "string",
      "description": "Email address of the contact"
    },
    "external_id": {
      "type": "string",
      "description": "External identifier for the contact"
    },
    "first_name": {
      "type": "string",
      "description": "First name of the contact"
    },
    "last_name": {
      "type": "string",
      "description": "Last name of the contact"
    },
    "middle_name": {
      "type": "string",
      "description": "Middle name of the contact"
    },
    "npn": {
      "type": "string",
      "description": "National Producer Number"
    },
    "phone": {
      "type": "string",
      "description": "Phone number of the contact"
    },
    "role": {
      "type": "string",
      "description": "Role of the contact"
    },
    "state": {
      "type": "string",
      "description": "State of the contact"
    },
    "street": {
      "type": "string",
      "description": "Street address of the contact"
    },
    "zip": {
      "type": "string",
      "description": "ZIP code of the contact"
    }
  },
  "required": ["id", "timestamp", "contact_id"],
  "additionalProperties": false
}
