{
  "id": "chg_123456789",
  "event_type": "contact.created",
  "origin": "ProducerFlowAPI",
  "timestamp": "2024-01-20T15:30:45Z",
  "agency_id": "agc_987654321",
  "city": "San Francisco",
  "contact_id": "cnt_456789123",
  "email": "john.doe@example.com",
  "external_id": "ext_789123456",
  "first_name": "John",
  "last_name": "Doe",
  "middle_name": "Robert",
  "npn": "12345678",
  "phone": "415-555-0123",
  "role": "Agent",
  "state": "CA",
  "street": "123 Market Street",
  "zip": "94105"
}
